{
  "$schema": "https://json-schema.org/draft/2020-12/schema",
  "title": "Photo library index (stage 1 output)",
  "type": "object",
  "required": ["schema_version", "library_root", "tooling", "photos", "albums", "featured"],
  "additionalProperties": false,
  "properties": {
    "schema_version": { "type": "integer", "const": 4 },
    "library_root": { "type": "string" },
    "tooling": {
      "type": "object",
      "required": ["exiftool", "extractor"],
      "additionalProperties": false,
      "properties": {
        "exiftool": { "type": "string" },
        "extractor": { "type": "integer" }
      }
    },
    "photos": { "type": "array", "items": { "$ref": "#/$defs/photo" } },
    "albums": { "type": "array", "items": { "$ref": "#/$defs/album" } },
    "locations": { "type": "array", "items": { "$ref": "#/$defs/location" } },
    "featured": { "type": ["array", "null"], "items": { "type": "string", "pattern": "^[0-9a-f]{16}$" } }
  },
  "$defs": {
    "photo": {
      "type": "object",
      "required": ["id", "source", "published", "rating", "captured_at", "alt", "tags",
                   "albums", "locations", "camera", "exposure", "rights", "file"],
      "additionalProperties": false,
      "properties": {
        "id": { "type": "string", "pattern": "^[0-9a-f]{16}$" },
        "source": { "type": "string" },
        "published": { "type": "boolean" },
        "rating": { "type": "integer", "minimum": 0, "maximum": 5 },
        "label": { "type": ["string", "null"] },
        "captured_at": {
          "type": ["string", "null"],
          "pattern": "^\\d{4}-\\d{2}-\\d{2}T\\d{2}:\\d{2}:\\d{2}$"
        },
        "title": { "type": ["string", "null"] },
        "caption": { "type": ["string", "null"] },
        "alt": { "type": "string", "minLength": 1 },
        "tags": { "type": "array", "items": { "$ref": "#/$defs/tag" } },
        "albums": { "type": "array", "items": { "type": "string" } },
        "locations": { "type": "array", "items": { "type": "string", "pattern": "^[a-z0-9-]+$" } },
        "camera": {
          "type": "object",
          "additionalProperties": false,
          "properties": {
            "make": { "type": ["string", "null"] },
            "model": { "type": ["string", "null"] },
            "lens": { "type": ["string", "null"] }
          }
        },
        "exposure": {
          "type": "object",
          "additionalProperties": false,
          "properties": {
            "f": { "type": ["number", "null"] },
            "shutter": { "type": ["string", "null"] },
            "iso": { "type": ["integer", "null"] },
            "focal": { "type": ["number", "null"] }
          }
        },
        "rights": {
          "type": "object",
          "additionalProperties": false,
          "properties": {
            "creator": { "type": ["string", "null"] },
            "rights": { "type": ["string", "null"] }
          }
        },
        "file": {
          "type": "object",
          "required": ["bytes", "width", "height", "mime", "sha256"],
          "additionalProperties": false,
          "properties": {
            "bytes": { "type": "integer", "minimum": 0 },
            "width": { "type": "integer", "minimum": 1 },
            "height": { "type": "integer", "minimum": 1 },
            "mime": { "type": "string" },
            "sha256": { "type": "string", "pattern": "^[0-9a-f]{64}$" }
          }
        }
      }
    },
    "tag": {
      "type": "object",
      "required": ["slug", "path", "leaf"],
      "additionalProperties": false,
      "properties": {
        "slug": { "type": "string", "pattern": "^[a-z0-9-]+$" },
        "path": { "type": "array", "minItems": 2, "items": { "type": "string" } },
        "leaf": { "type": "string" }
      }
    },
    "location": {
      "type": "object",
      "required": ["slug", "tag", "title", "path", "lat", "lon", "photo_count"],
      "additionalProperties": false,
      "properties": {
        "slug": { "type": "string", "pattern": "^[a-z0-9-]+$" },
        "tag": { "type": "string" },
        "title": { "type": "string" },
        "path": { "type": "array", "minItems": 1, "items": { "type": "string" } },
        "lat": { "type": ["number", "null"], "minimum": -90, "maximum": 90 },
        "lon": { "type": ["number", "null"], "minimum": -180, "maximum": 180 },
        "description": { "type": ["string", "null"] },
        "photo_count": { "type": "integer", "minimum": 0 }
      }
    },
    "album": {
      "type": "object",
      "required": ["slug", "tag", "title", "cover", "first_year", "last_year", "photo_count", "unlisted"],
      "additionalProperties": false,
      "properties": {
        "slug": { "type": "string", "pattern": "^[a-z0-9-]+$" },
        "tag": { "type": "string" },
        "title": { "type": "string" },
        "date": { "type": ["string", "null"] },
        "cover": { "type": ["string", "null"], "pattern": "^[0-9a-f]{16}$" },
        "first_year": { "type": ["string", "null"], "pattern": "^\\d{4}$" },
        "last_year": { "type": ["string", "null"], "pattern": "^\\d{4}$" },
        "intro": { "type": ["string", "null"] },
        "photo_count": { "type": "integer", "minimum": 0 },
        "unlisted": { "type": "boolean" }
      }
    }
  }
}
